[
  {
    "nom_complet": "Fatou Traore",
    "secteur_activite": "Commerce alimentaire",
    "objet_credit": "Achat de marchandises",
    "montant_demande": 500000,
    "duree_mois": 12,
    "chiffre_affaires": 700000,
    "achats_marchandises": 400000,
    "loyer_activite": 50000,
    "transport_activite": 30000,
    "autres_charges_activite": 40000,
    "alimentation": 50000,
    "logement": 30000,
    "transport_personnel": 15000,
    "autres_depenses_menage": 25000,
    "mensualite_dette_existante": 20000,
    "anciennete_activite_mois": 60,
    "nombre_retards": 2,
    "regularite_tontine": "reguliere",
    "credits_termines": 3
  },
  {
    "nom_complet": "Ibrahim Konate",
    "secteur_activite": "Artisanat métallique",
    "objet_credit": "Achat d'outillage",
    "montant_demande": 300000,
    "duree_mois": 12,
    "chiffre_affaires": 620000,
    "achats_marchandises": 260000,
    "loyer_activite": 45000,
    "transport_activite": 25000,
    "autres_charges_activite": 40000,
    "alimentation": 80000,
    "logement": 40000,
    "transport_personnel": 15000,
    "autres_depenses_menage": 35000,
    "mensualite_dette_existante": 20000,
    "anciennete_activite_mois": 72,
    "nombre_retards": 1,
    "regularite_tontine": "reguliere",
    "credits_termines": 2
  },
  {
    "nom_complet": "Awa Diallo",
    "secteur_activite": "Commerce de vêtements",
    "objet_credit": "Renouvellement du stock",
    "montant_demande": 450000,
    "duree_mois": 12,
    "chiffre_affaires": 1500000,
    "achats_marchandises": 1190000,
    "loyer_activite": 90000,
    "transport_activite": 60000,
    "autres_charges_activite": 80000,
    "alimentation": 45000,
    "logement": 35000,
    "transport_personnel": 20000,
    "autres_depenses_menage": 30000,
    "mensualite_dette_existante": 25000,
    "anciennete_activite_mois": 18,
    "nombre_retards": 4,
    "regularite_tontine": "partielle",
    "credits_termines": 1
  }
]
